title,Related
searched for jal neti,no
visited kelu krishna lyrics   rama rama re      kannada songs lyrics,no
visited kelu krishna lyrics in kannada  rama rama re kelu krishna song    ,no
searched for kelu krishna helu partha,no
visited scientists troubled by icmr s deadline for bharat biotech s covid    ,no
visited covaxin controversy  bharat biotech icmr readying a covid       ,no
searched for bharat biotech icmr vaccine,no
used google play services,no
searched for se,no
searched for nse  vedl,no
searched for nse  ashokley,no
searched for nse  axisbank,no
searched for nse  bpcl,no
searched for google finance,no
used google play services,no
searched for se,no
visited nike blue ribbon sports cap hardlooppet unisex multi   all running,no
searched for nike tailwind blue ribbon sports,no
used google play services,no
searched for se,no
visited elyments   india s own super app,no
searched for elyments login,no
visited a brutally honest review of my    day silent vipassana meditation    ,no
searched for no contact meditation is called ,no
searched for modi attempt to asana,no
visited vipassana meditation  netherlands,no
searched for vipassana netherlands,no
searched for elyments,no
used google play services,no
searched for se,no
visited http   www primevideo com ,no
searched for amazon prime video,no
searched for amazon in prime,no
visited mercedes benz international  news  pictures  videos   livestreams ,no
searched for mercedes,no
visited bmw nl  bmw nederland   offici le website van bmw nederland,no
searched for bmw,no
visited calculate the current value of the car  quickly check of your car    ,no
searched for buy used car independer,no
visited saaho   wikipedia,no
searched for sahoo box office collection,no
used google play services,no
searched for se,no
visited https   en m wikipedia org wiki journey    the mysterious island,no
searched for journey  ,no
used google play services,no
searched for se,no
visited google trends,no
visited google ngram viewer,no
searched for google word usage search,no
used google play services,no
searched for se,no
visited https   www news   com amp news buzz thank you for provocation anand mahindra on chinas threat to ban indian goods         html,no
searched for anand mahindra counter to china,no
visited tqdm   pypi,yes
searched for pip tqdm,yes
searched for tqdm,yes
searched for current coronavirus r in india,no
searched for current coronavirus reproduction rate in india,no
visited india s  r  dips to       active covid cases could now be     lakh    ,no
visited coronavirus outbreak  how fast is the virus reproducing in india    ,no
searched for coronavirus reproduction rate in india,no
visited hindi   alphabets  vowels   consonants   hindi swiftutors com,no
searched for vowels and consonants in hindi,no
searched for vowels and consonants,no
visited ttd news,no
visited ttd   latest and breaking news on ttd   tnie,no
searched for ttd current news,no
used google play services,no
searched for se,no
used google play services,no
used google play services,no
searched for set,no
used google play services,no
searched for sett,no
used google play services,no
searched for se,no
used google play services,no
searched for set,no
visited the netherlands   oecd,no
searched for number of taxpayers in netherlands,no
searched for tax payers in netherlands,no
visited budget       the deceptive rise in india s income tax base   the    ,no
visited https   timesofindia indiatimes com articleshow          cms,no
searched for percentage of taxpayers in india,no
visited bharat biotech has passed mandated protocols  animal testing and    ,no
viewed bharat biotech,no
searched for bharat biotech,no
visited welcome to prime video,no
searched for amazon prime video,no
visited warning about too many open figures   stack overflow,yes
searched for figures created through the pyplot interface   matplotlib pyplot figure   are retained until explicitly closed and may consume too much memory ,yes
searched for air france klm stock price,no
searched for boeing stock price,no
searched for hudco stock price,no
searched for tesla stock price,no
searched for inovio pharmaceuticals stock,no
visited tqdm  python progress bar made easy   by karan bhanot   towards    ,yes
visited progress bars in python  when dealing with large data  even    by    ,yes
searched for tqdm python,yes
visited mlflow   a platform for the machine learning lifecycle   mlflow,yes
searched for mlflow,yes
searched for finance,no
visited developers   stuck at  kernel starting  please wait         bountysource,yes
visited installed jupyter notebook for python       stuck at  kernel starting    ,yes
visited using virtual environments in jupyter notebook and python    ,yes
searched for jupyter notebook stuck on kernel starting please wait in virtualenv,yes
visited configuration overview   jupyter notebook       documentation,yes
searched for jupyter profile settings,yes
visited ipython notebook always shows  kernel starting  please wait    ,yes
visited https   github com  google extract  cbcde ec ab  fe  google e  jupyter  google e  notebook  google e  issues  google e       ,yes
visited https   github com  google extract  cbcde ec ab  fe  google e  jupyter  google e  notebook  google e  issues  google e       ,yes
searched for jupyter notebook stuck on kernel starting please wait,yes
searched for in anaconda virtual environment jupyter notebook is not created,yes
visited how do i know the current version of pytorch    vision   pytorch    ,yes
searched for check pytorch version,yes
visited itsdangerous   pypi,yes
searched for itsdangerous python,yes
searched for population of andhra pradesh,no
searched for kerala population,no
visited solar impulse foundation       profitable solutions for the    ,no
searched for solar impulse  ,no
visited easa certifies electric aircraft  first type certification for fully electric    ,no
searched for easa electrical plane certification,no
searched for supersonic aircraft,no
visited boeing to end     jumbo jet production after more than    years    ,no
searched for boeing     production,no
searched for antonov    ,no
searched for deepfake,yes
visited this person does not exist,yes
searched for fake face,yes
searched for botox treatment meaning,no
searched for botox treatment,no
visited cuda toolkit on windows     here i am explaining a step by step    ,yes
searched for check cuda version in windows   ,yes
searched for nvidia     ,no
searched for nvidia         driver,no
visited gpu setup   tuflow,yes
searched for is nvidia quadro p     called cuda ,yes
searched for is nvidia quadro p     a gpu ,yes
searched for what is nvidia quadro p    ,yes
visited         nvcc   version command says nvcc is not installed   ask    ,yes
searched for name  nvcc  is not defined,yes
visited how to get the cuda version    stack overflow,yes
searched for check cuda version in python notebook,yes
visited how to test if installed torch is supported with cuda   pytorch forums,yes
visited pytorch     get cuda version   pytorch forums,yes
searched for check cuda version pytorch,yes
visited anaconda check cuda version   ormashop it,yes
searched for how to check cuda version in jupyter notebook,yes
visited how to get the cuda version    stack overflow,yes
searched for how to check cuda version anaconda,yes
visited how to check if cuda is installed correctly on anaconda   stack    ,yes
visited pytorch,yes
visited pytorch install   quick and easy   deeplizard,yes
searched for install pytorch,yes
visited transfer money online   send money abroad with transferwise,no
searched for transferwise,no
searched for nse  gichsgfin,no
searched for nse  lichsgfin,no
searched for google finance,no
searched for finance,no
searched for google finance,no
visited mlflow   a platform for the machine learning lifecycle   mlflow,yes
searched for mlflow,yes
searched for flattened rice videos,no
searched for poha,no
searched for finance,no
searched for nasdaq  ino,no
searched for jockey share price,no
searched for irctc book value,no
searched for lic housing finance book value,no
searched for gic housing finance book value,no
searched for hudco book value,no
searched for nse  tatamotors,no
searched for nse  gichsgfin,no
searched for google finance,no
searched for boeing stock price,no
searched for boeing stock price,no
searched for southwest airlines stock,no
searched for nse  gichsgfin,no
searched for nasdaq  ino,no
searched for google finance,no
searched for google finance,no
searched for google finance,no
searched for google translate,no
viewed european federation of psychologists  associations  efpa ,no
visited machine learning scholarship with microsoft azure   udacity,yes
searched for machine learning scholarship program for microsoft azure,yes
searched for google finance,no
visited https   wap business standard com company bharat immunolog      html,no
searched for bharat biotech share price live,no
searched for nasdaq  ino,no
searched for finance,no
searched for nasdaq  ino,no
searched for google finance,no
searched for boeing share price,no
searched for airbus stock price,no
searched for nasdaq  ino,no
searched for google finance,no
searched for modak,no
viewed modak biplob,no
visited hoofddorp  north holland  netherlands three day weather    ,no
searched for weather in hoofddorp,no
visited indian calendar        indian festivals   holidays   panchang,no
searched for indian festival calendar     ,no
visited wonen in tudorstijl   nieuwbouw in hoofddorp       tudorpark,no
searched for tudor park,no
viewed tudorhouse,no
searched for population of greenland,no
visited the rpc server is unavailable   exception from hresult    ,no
searched for the rpc server is unavailable   exception from hresult   x      ba ,no
visited https   m timesofindia com life style health fitness weight loss weight loss story this banker lost      kilos without dieting and her transformation is jaw dropping amp articleshow          cms,no
searched for weight loss transformation india,no
searched for weight loss transformation,no
searched for google finance,no
searched for google finance,no
searched for google finance,no
searched for google finance,no
searched for nasdaq  ino,no
visited infinity games continues its loop saga  now with loop energy,no
visited infinity loop  energy       for android   download   uptodown com,no
searched for loop energy game created by,no
searched for loop energy game inventor,no
viewed loop energy inc ,no
searched for nasdaq  ino,no
searched for google finance,no
visited convert html or word to chm without installation   stack overflow,yes
visited html to chm converter  convert html to chm   softany com,yes
searched for convert html file to chm,yes
visited download html help workshop and documentation from official    ,yes
searched for html help workshop,yes
visited html help workshop returns error after successfully compiled  chm    ,yes
searched for error compiling chm file,yes
visited error message when you try to install an application on a windows    ,yes
searched for html help workshop command line option syntax error,yes
visited chmprocessor  a html   word converter to compiled html help    ,yes
visited chmprocessor  word html to chm converter   osdn net,yes
visited winchm pro   create help files  html help authoring tools  make    ,yes
visited wordtohelp   doc to chm  word to chm converter  create chm    ,yes
visited how to create chm file from word   efficiency,yes
searched for chm processor convert word to html,yes
searched for nse  gichsgfin,no
searched for finance,no
searched for data intelligence in python,yes
visited is there any way to automatic detect required modules and    ,yes
searched for python library for auto detection,yes
visited    python libraries for data science you should know   dataquest,yes
searched for python libraries for data analysis,yes
searched for python libraries for data intelligence and suggestions,yes
visited    simple hacks to speed up your data analysis in python   morioh,yes
visited lesser known python libraries for data science   by parul pandey    ,yes
visited   must have tools if you re serious about machine learning,yes
searched for python libraries like pandas profiling,yes
visited pandas profiling to boost exploratory data analysis   by sandeep    ,yes
visited exploratory data analysis with pandas profiling   by albert sanchez    ,yes
visited speed up your exploratory data analysis with pandas profiling   by    ,yes
visited pandas profiling pandas profiling  create html profiling       github,yes
searched for pandas profiling,yes
searched for python libraries for data intelligence ,yes
visited what is data intelligence    sisense,yes
searched for data intelligence,yes
searched for voice of survey,yes
visited how to resolve  the requested operation requires elevation  error    ,no
searched for the requested operation requires elevation chm processor,no
visited chmprocessor,no
searched for chm processor,no
searched for waspik meaning,no
searched for rectum meaning,no
searched for bharat biotech share price live,no
visited bharat immunologicals and biologicals corporation       moneycontrol,no
searched for bharat biotech share,no
viewed bharat biotech,no
searched for bharat biotech international ltd,no
searched for boeing share price,no
searched for google finance,no
searched for fra  afr,no
searched for nse  gichsgfin,no
searched for google finance,no
visited  srikant  is back with  the family man season     will srikant be    ,no
visited top gainers today   nse top gainers live  bse top gainers today,no
visited top ten gainers   losers   nse   national stock exchange of india    ,no
visited why inovio stock fell today   the motley fool,no
searched for flights from amsterdam to   on jul          returning jul         ,no
visited home exchange   homeexchange,no
visited informatie over de nieuwe playstation     mediamarkt,no
visited sony playstation    ps     mediamarkt,no
visited mediamarkt,no
visited earn     in transaction credit   degiro,no
visited apk keuringskosten   anwb,no
visited justlease nl,no
viewed justlease,no
visited https   en m wikipedia org wiki education in the netherlands,no
visited justlease nl,no
viewed justlease,no
visited tamil nadu custodial deaths  discrepanices in fir  gory eyewitness    ,no
searched for       increase in share price india,no
searched for mukesh ambani recent investment,no
searched for made in prc means,no
visited hp laserjet pro mfp m  w   laserprinter   bol com,no
visited hp laserjet pro mfp m  w   coolblue   before        delivered    ,no
searched for hp laserjet pro mfp m  w printer,no
visited inovio  advancing covid    shot  scores dod deal to scale up    ,no
visited inovio pharmaceuticals  inc   ino  stock price  quote  history    ,no
searched for inovio pharmaceuticals,no
searched for euro to dollar,no
visited error  loading local data is disabled   this must be enabled on    ,yes
searched for error code        loading local data is disabled  this must be enabled on both the client and server sides,yes
visited a walkthrough of sql schema   sqlshack,yes
searched for initiating the schema in sql server,yes
visited why i am getting error  incorrect syntax near the keyword  where    ,yes
visited incorrect syntax near the keyword  use  error while creating    ,yes
searched for incorrect syntax near the keyword  use  ,yes
searched for translate google,no
searched for nse  gichsgfin,no
searched for nyse  ba,no
used google play services,no
searched for you,no
visited smartwatches   denver electronics,no
searched for denver smartwatch,no
visited klantenservice media markt,no
searched for mediamarkt customer service,no
visited free online course  aircraft maintenance from swayam   class    ,no
visited aircraft maintenance   nptel,no
searched for aircraft maintenance nptel,no
visited nptel online courses mobile,no
visited nptel online courses mobile,yes
visited nptel  online courses and certification  learn for free,yes
searched for nptel online courses,yes
searched for nse  tatamotors,no
visited independer   vergelijk en bespaar direct,no
searched for independer,no
viewed independer   vergelijk verzekeringen,no
visited blg wonen   we kijken naar wat er w l mogelijk is  zodat jij kunt    ,no
searched for blg wonen,no
viewed blg wonen,no
visited https   webcache googleusercontent com search q cache leljck tskej https   www blgwonen nl home html  cd   hl en ct clnk gl nl,no
visited pricewise in english   compare now   pricewise nl,no
visited how much car can i afford  click here to find out,no
visited car loan calculator   dutch point credit union,no
searched for pricewise car loan calculator,no
searched for pricewisecar loan calculator,no
visited text recognition  ocr  using cognitive service  microsoft flow    ,yes
searched for azure cognitive services ocr demo,yes
visited ocr cognitive skill   azure cognitive search   microsoft docs,yes
visited computer vision   microsoft azure,yes
searched for azure cognitive services ocr,yes
visited liminary   definition of liminary by merriam webster,yes
searched for liminary definition,yes
visited deep learning is blowing up ocr  and your field could be next    ,yes
visited creating a modern ocr pipeline using computer vision and deep    ,yes
visited deep learning based ocr for text in the wild   nanonets,yes
visited optical character recognition using deep learning techniques    ,yes
searched for document ocr deep learning,yes
visited relevance  ranking and search  interesting journey of a search    ,yes
searched for find relevant and non relevant documents using machine learning,yes
searched for find relavent and non relavent documents,yes
visited sri afsar pasha vs smt kempamma on    february      ,no
searched for channamanahalli   kylancha hobli ramanagara district,no
searched for brazil population,no
searched for nse  gichsgfin,no
visited amit shah speaks to jagannath temple committee chairperson on    ,no
searched for ratha yatra puri,no
searched for area of piduguralla,no
searched for area of hoorn,no
searched for population of hoorn,no
searched for population of piduguralla,no
visited hdfc bank,no
searched for hdfc netbanking,no
visited sri afsar pasha vs smt kempamma on    february      ,no
visited villages   towns in ramanagara taluka of ramanagara  karnataka,no
searched for channamanahalli   kylancha hobli ramanagara district,no
searched for channamanahalli   kylancha hobli,no
visited deep learning based text recognition  ocr  using tesseract and    ,yes
visited our search for the best ocr tool  and what we found   features    ,yes
searched for why to use tesseract or abbey when we can use deep learning for ocr,yes
visited heroku  cloud application platform,yes
searched for heroku,yes
searched for jharkhand chief minister party,no
searched for chhattisgarh chief minister party,no
searched for himachal pradesh chief minister party,no
searched for odisha chief minister,no
searched for odisha government,no
visited centimeters to feet  cm to feet  conversion calculator   rapidtables,no
searched for cms to feet,no
visited myntra  online shopping for women  men  kids fashion   lifestyle,no
searched for myntra,no
visited silk n toothwave   coolblue   before        delivered tomorrow,no
visited silkn tw pe       elektronica online kopen    beslist nl   ruime    ,no
searched for tw pe    ,no
searched for lic housing finance,no
searched for alok industries share,no
visited woz waardeloket,no
searched for woz waarde,no
visited http   www jandemakelaar nl ,no
searched for jandemakelaar,no
viewed jandemakelaar,no
visited https   en m wikipedia org wiki naga shaurya,no
searched for naga shourya,no
searched for nyse  ba,no
visited eclipses visible in amsterdam  netherlands   time and date,no
searched for solar eclipse in netherlands,no
visited europe stocks   robinhood,no
searched for robinhood europe,no
visited acorns   invest  earn  grow  spend  later   acorns,no
searched for acorns,no
viewed home decoration ideas,no
visited top up prepaid credit   lebara nl,no
searched for lebara one top up,no
visited    unique secret santa gifts for friends and coworkers  all under        ,no
searched for gift ideas for employees working from home lessthan    eur,no
visited best gifts for people who work from home        reviews by    ,no
visited    work from home gift ideas for remote employees   xoxoday,no
searched for gift ideas for employees working from home,no
searched for gifts for employees working from home netherlands,no
visited guide  the best      holiday gifts for remote workers,no
visited the ultimate holiday gift guide for people who work from home    ,no
visited    gift ideas for anyone who works from home   wired,no
visited https   www goskills com office productivity articles gifts for people who work from home,no
visited    best work from home gifts to get him or her this year    ,no
searched for gifts for employees working from home,no
visited    thoughtful corporate gifts to buy in       baggu  milk bar    ,no
visited    gifts for employees        best gifts for employees   the cut,no
searched for gifts for employees,no
visited https   www amazon nl gp help customer display html ie utf  nodeid          ,no
searched for order amazon nl gift card,no
visited amazon com gift cards,no
searched for order amazon gift card,no
searched for           ,no
visited vergelijk onze expertclean     philips,no
searched for expertclean hx        vs expertclean hx       ,no
searched for oral b,no
visited oral b genius x       luxury edition rose gold   coolblue    ,no
visited genius x       grijze elektrische tandenborstel luxe editie   oral b,no
searched for oral b genesis x      ,no
visited philips sonicare diamondclean smart hx          coolblue    ,no
visited philips sonicare diamondclean smart hx              bol com,no
visited vergelijk onze diamondclean smart     philips,no
searched for philips sonicare diamondclean smart,no
searched for father s day india,no
searched for mens long hairstyles,no
searched for life span of a duck,no
visited electric toothbrush vs  manual toothbrush  which is better ,no
visited electric toothbrush vs manual toothbrush  pros   cons,no
searched for cons of electric toothbrush,no
visited reset your beats earphones   beats by dre,no
searched for one powerbeats pro not working,no
visited http   www tulsi restaurant nl ,no
searched for tulsi restaurant,no
viewed tulsi indian restaurant,no
searched for tulasi vegetarian restaurant,no
viewed tulasi vegetarian restaurant,no
visited tulsi indian restaurant amsterdam   delicious indian cuisine,no
searched for nyse  ba,no
visited https   bynco com nl,no
viewed bynco com,no
searched for bynco,no
searched for kia rio,no
searched for ford freestyle,no
searched for tata altroz,no
visited https   www carwale com marutisuzuki cars ertiga amp ,no
searched for ertiga on road price,no
searched for vertigo,no
searched for ford figo,no
searched for nse  coalindia,no
searched for nse  vedl,no
searched for nse  hdfcbank,no
searched for nse  bajajfinsv,no
searched for nse  dhfl,no
searched for nse  lichsgfin,no
searched for nse  gichsgfin,no
searched for nse  tatamotors,no
visited padhai   ai courses by iit madras faculty,yes
searched for padhai,yes
searched for chiranjeevi age,no
searched for shankar dada mbbs,no
searched for nse  irctc,no
searched for ams  agn,no
searched for nse  lichsgfin,no
searched for nse  gichsgfin,no
searched for hertz stock price,no
visited punten   ing,no
searched for ing philips,no
visited hdfc         bangalore   bwssb extn       ifsc code,no
visited hdfc bank branch in kempegowda road  bengaluru        ,no
searched for hdfc cauvery bhavan,no
viewed hdfc bank,no
visited hdfc bank,no
searched for hdfc netbanking,no
visited how to set an out of office reply in outlook      and prior   laptop    ,no
searched for out of office notification outlook     ,no
searched for nse  pnb,no
searched for nse  ashokley,no
searched for nse  bankbaroda,no
searched for ams  inga,no
searched for nse  gichsgfin,no
searched for nyse  ba,no
searched for nyse  ba,no
searched for nasdaq  tsla,no
searched for gic housing finance ltd  share price,no
searched for lic housing finance share price,no
searched for nse  gichsgfin,no
searched for nse  irctc,no
searched for gic housing finance ltd  share price,no
searched for lic housing finance share price,no
searched for nse  lichsgfin,no
searched for gic housing finance ltd  share price,no
searched for lic housing finance share price,no
visited gic housing finance target share price  gic housing finance    ,no
visited gic housing finance ltd    moneycontrol,no
searched for gic housing finance,no
searched for nse  gichsgfin,no
searched for nyse  ba,no
searched for airbus share price,no
searched for gbx currency,no
searched for astrazeneca share price,no
searched for audi share price is high,no
searched for why audi share price is high,no
visited should you be tempted to sell audi ag  etr nsu  because of its    ,no
searched for audi share price spike explained,no
searched for nse  irctc,no
searched for nse  tatamotors,no
searched for the cat s eye nebula,no
searched for   light year in km,no
searched for betelgeuse,no
searched for vy canis majoris,no
searched for bm  ,no
visited ranking methods in machine learning   uchicago stat,yes
visited https   m youtube com watch v  uplin t e ,yes
searched for ranking algorithm in machine learning,yes
visited hdfc bank,no
searched for hdfc netbanking,no
