title,Related
visited how i convert different date python format    stack overflow,yes
searched for convert mmm yyyy to dd mm yyyy in python,yes
visited pandas out of bounds nanosecond timestamp after offset rollforward    ,yes
searched for out of bounds nanosecond timestamp                  ,yes
visited remove empty columns   github,yes
visited https   stackoverflow com questions          python pandas dataframe remove empty cells,yes
searched for delete all columns from dataframe pandas whose values are empty,yes
visited https   pandas pydata org pandas docs stable generated pandas dataframe count html,yes
searched for count column name in a dataframe using pandas,yes
visited get list from pandas dataframe column headers   stack overflow,yes
searched for column name in a dataframe using pandas,yes
visited https   www lendingclub com info download data action,no
searched for lending club europe,no
searched for delinquent meaning,no
visited ov chipkaart   home,no
searched for ov chipcard,no
visited type i errors  type ii errors  and the power of the test   youtube,yes
visited type   errors  video    khan academy,yes
searched for importance of values of alpha and beta type   and type   errors,yes
visited type i and type ii error and alpha value relationship in research ,yes
visited type i and type ii errors   an overview   sciencedirect topics,yes
visited https   support minitab com en us minitab    help and how to statistics basic statistics supporting topics basics type i and type ii error ,yes
searched for values of alpha and beta type   and type   errors,yes
visited https   m facebook com kannadatalkieseurope ,no
searched for kgf movie in netherlands,no
searched for kgf in netherlands,no
searched for  k cinemas netherlands,no
visited https    kcinema com ,no
searched for  k cinemas,no
searched for ensuite bathroom,no
searched for heidelberg castle germany,no
visited airbnb  vacation rentals  homes  hotels  experiences   more,no
searched for airbnb,no
visited booking com   official site   the best hotels   accommodations,no
searched for booking com,no
visited http   www icscards nl abnamro login,no
searched for ics credit card abn amro login,no
searched for flights from ein to salzburg on dec          returning dec         ,no
searched for flights from ein to vie on dec          returning dec         ,no
searched for flights from ein to vie on dec          returning dec         ,no
searched for flights from ein to salzburg on dec          returning dec         ,no
searched for flights from amsterdam to salzburg on dec          returning dec         ,no
searched for flights from amsterdam to vienna on dec          returning dec         ,no
searched for flights from amsterdam to vienna on jan         returning jan         ,no
searched for flights from amsterdam to austria on jan         returning jan         ,no
visited car rentals at schiphol   schiphol,no
searched for rentalcars amsterdam,no
visited https   www jetprivilege com ,no
searched for jetprivilege,no
visited car rental amsterdam from       expedia com,no
visited europcar  car rental   rent a car worldwide,no
searched for europcar,no
searched for go ,no
searched for stern car rental,no
visited cheap car hire amsterdam   rentalcars com,no
searched for google translate,no
searched for   rd birthday meaning,no
searched for   th birthday meaning,no
visited https   www partydelights co uk themes adult age balloons aspx,no
searched for which age are balloons for birthday,no
searched for what age are balloons for birthday,no
searched for what age are balloons for,no
visited how to calculate percent yield in chemistry     steps,no
searched for calculation of yield,no
visited https   m youtube com watch v tekobw br w,no
visited https   m youtube com watch v m  bmcjqhtm,no
searched for lakshmi s ntr,no
searched for heat maps,no
visited cost of living in ramallah  jul       prices in ramallah,no
searched for cost of living in ramallah  palastine vs amsterdam,no
visited cost of living comparison between amsterdam and tel aviv yafo,no
searched for cost of living in ramallah vs amsterdam,no
searched for salaries in ramallah     ,no
searched for software tester salaries in ramallah     ,no
visited software tester salary in netherlands   payscale,no
searched for software tester salaries in ramallah,no
visited top companies in ramallah  west bank    glassdoor,no
visited ramallah           average salary survey,no
searched for salaries in ramallah,no
searched for merry christmas,no
visited chapter   credit risk,no
searched for expected loss formula,no
visited      jeep  renegade   a compact suv for life on the go,no
searched for jeep renegade,no
visited dacia  auto s  bedrijfswagens  elektrisch en lpg,no
visited https   m dacia nl home html,no
searched for dacia netherlands,no
visited https   www carsontheweb com en cms used cars holland,no
visited cars for sale in holland  mi  with photos    autotrader,no
visited https   www exportwagen eu ba used cars netherlands,no
visited http   www ooyyo com netherlands used cars for sale c cda  d    d    f   bfa faa       ,no
searched for used cars in netherlands for sale,no
visited http   filmsforliberation com review aspx reid     ,no
searched for sachin daughter,no
searched for bacon meaning,no
searched for beacon meaning,no
searched for google translate,no
searched for migrants definition,no
searched for migrants,no
visited how to truncate number text string in excel    extendoffice,no
searched for formula to truncate text in excel,no
visited https   github com  google extract  cbcde ec ab  fe  google e  mobz  google e  elasticsearch head  google e  issues  google e     ,no
visited https   github com  google extract  cbcde ec ab  fe  google e  mobz  google e  elasticsearch head  google e  issues  google e     ,no
searched for login popup for elasticsearch head,no
visited how to write permutation and combination in microsoft word    ,no
searched for how to write permutations combinations in word,no
visited https   support office com en us article insert mathematical symbols   a b  c   a   de  bd       e  bed  ,no
searched for how to write combinations in word,no
visited http   www findtechtalent nl ,no
searched for find tech talent,no
visited https   business linkedin com talent solutions job descriptions data analyst,yes
visited https   www linkedin com title data analyst,yes
searched for skills required for data analytics job by linkedin,yes
searched for what percentage of analytics jobs require elasticsearch elasticsearch,yes
visited cost of living comparison between oslo  norway and amsterdam    ,no
searched for cost of living amsterdam vs oslo,no
visited https   www glassdoor com salaries ,no
visited glassdoor hourly salaries   glassdoor,no
searched for glassdoor salaries,no
visited linkedin salary  explore real salaries  find your upside   linkedin,no
searched for linkedin salary,no
searched for rupee to nok,no
searched for norway currency,no
visited python elasticsearch client   elasticsearch       documentation,yes
visited python elasticsearch client   elasticsearch       documentation,yes
searched for connect to elasticsearch clusters using python,yes
visited newpeople  home,no
searched for new people netherlands ,no
searched for how many times in a day the hands of a clock are straight,no
visited https   www mastguru com which of the following keywords are used to control access to a class member      amp,no
searched for keyword used to control access to a class member,no
visited is there a difference between x   and   x in java    stack overflow,yes
searched for algorithmic trading,yes
defined slippage,no
searched for orders that can be cancelled while in order book,no
searched for market order cancellation,no
searched for market order,no
searched for cancel order,no
searched for relative tight bollinger bands,no
visited bull market definition   investopedia,no
searched for bear and bull market definition,no
visited https   support office com en us article linear format equations using unicodemath and latex in word  e     d b fd   d   cb   d  f     f ,no
searched for latex symbols in ms word,no
visited list of latex mathematical symbols   oeiswiki,no
searched for latex symbols,no
searched for google translate,no
visited how to install elasticsearch   kibana       on windows    byvy    ,yes
visited elasticsearch kibana installation windows   youtube,yes
visited download kibana free   get started now   elastic   elastic,yes
searched for install kibana windows,yes
visited how to extract data to csv easily in kibana discover tab   kibana    ,yes
searched for how much time does it take to extract kibana,yes
visited https   www averoachmea nl consument gezondheid directregelen paginas zorggebruik aspx,no
searched for avero achmea login,no
visited av ro achmea  de waarde van advies,no
searched for avero achmea,no
visited https   www airfrance nl nl en common guidevoyageur pratique sante anti stress htm,no
visited overcoming fear of flying   part     klm blog,no
searched for fear of flying course amsterdam,no
visited https   www britishairways com information travel assistance flying with confidence,no
searched for fear of flying course,no
searched for fear of flying book,no
visited how to fix resolving host  dns  issues on windows   ghacks tech    ,no
visited google chrome  resolving host  error on every dns except    ,no
searched for dns error resolving host dashboard test aerdata loc  no such host,no
searched for dichotomous meaning,no
searched for dichotomy meaning,no
visited cognitive class  data science and cognitive computing courses,yes
searched for cognitive class  ai,yes
visited http   www speedtest net ,no
searched for speed test,no
searched for satya nadella family pics,no
visited satya nadella   wikipedia,no
searched for satya nadella family background,no
visited microsoft ceo satya nadella practices one mind training exercise    ,no
visited what is the daily routine of satya nadella    quora,no
searched for satya nadella daily life,no
visited linkedin salary  explore real salaries  find your upside   linkedin,no
searched for linkedin salary,no
searched for reopen the closed tab in chrome,no
visited sunrise and sunset times in amsterdam   time and date,no
searched for sunrise and sunset amsterdam,no
visited get api   elasticsearch reference         elastic,yes
visited make elasticsearch only return certain fields    stack overflow,yes
searched for extract only one document in elasticsearch return,yes
visited https   www elastic co guide en elasticsearch reference      introducing the query language html,yes
visited query dsl   elasticsearch reference         elastic,yes
searched for querying in elasticsearch,yes
searched for query string in elasticsearch,yes
visited https   www elastic co guide en elasticsearch reference     query dsl filtered query html,yes
visited https   www elastic co guide en elasticsearch reference     query dsl query filter html,yes
visited query and filter context   elasticsearch reference         elastic,yes
searched for query filter in elasticsearch,yes
searched for anti caste movement in india pdf,no
visited     years of anti caste struggle   jacobin,no
visited https   economictimes indiatimes com articleshow          cms,no
visited http   shodhganga inflibnet ac in bitstream                  chapter     pdf,no
searched for supporters of anti caste movements in india,no
visited https   uk tlscontact com nl ams page php pid procedure,no
searched for uk visa from netherlands for indian,no
searched for uk visa from netherlands,no
searched for uk visa amsterdam,no
visited amsterdam school of data science,yes
searched for data science courses in amsterdam,yes
visited correlation does not imply causation   wikipedia,yes
searched for causation vs correlation,yes
searched for causation definition,yes
visited understaning reference line in tableau   youtube,yes
searched for reference line tableau,yes
searched for reference line,yes
visited standard normal distribution table   math is fun,yes
visited http   sphweb bumc bu edu otlt mph modules bs bs    probability bs    probability  html,yes
searched for normal distribution table   standard deviations,yes
visited https   math arizona edu  rsims ma    standardnormaltable pdf,yes
searched for normal distribution table,yes
searched for indian restaurants in amsterdam central,no
visited https   www infoplease com world population statistics population density square mile countries,no
searched for density of populations of countries,no
searched for china currency to rupee,no
visited http   www speedtest net ,no
searched for speed test,no
visited amsterdam  north holland  netherlands three day weather    ,no
searched for weather in amsterdam,no
searched for snowfall in amsterdam,no
visited world s best lasagna recipe   allrecipes com,no
searched for lasagna recipe,no
visited how to use word tokenize in data frame   stack overflow,yes
searched for apply word tokenizer to column in a dataframe,yes
searched for nice hairstyles for guys,no
searched for network connectivity issues oracle vmware,no
visited https   www amstelveen nl english publicatie registration and residence permit,no
searched for gemeente amstelveen registration online,no
visited amsterdam  north holland  netherlands three day weather    ,no
searched for snow prediction in amsterdam,no
visited  tutorial  generate word clouds in python   datacamp,yes
searched for import wordcloud python,yes
searched for snowfall in amsterdam,no
visited isupper    islower    lower    upper   in python and       geeksforgeeks,yes
visited check for upper cases using isupper   function in pandas python    ,yes
searched for check for uppercase in a column data python,yes
visited dive into nltk  part iv  stemming and lemmatization   text mining    ,yes
searched for nltk stemming python example,yes
visited stemming words with nltk   python programming tutorials,yes
searched for porterstemmer python,yes
defined idiot,no
visited hdfc bank,no
searched for hdfc netbanking login,no
visited channelengine   do more with online marketplaces,no
searched for channelengine,no
visited tokenizing words and sentences with nltk   python tutorial,yes
searched for use word tokenize python,yes
visited how to display full  non truncated  dataframe information in html    ,yes
searched for how to see full text in a column in python dataframe,yes
visited pandas dataframes  how to wrap text with no whitespace   stack    ,yes
searched for how to text wrap in python dataframe,yes
visited regular expressions info   regex tutorial  examples and    ,yes
visited regexr  learn  build    test regex,yes
visited nlp for hackers   a blog about simple and effective natural    ,yes
searched for nlp for hackers,yes
visited https   learnpythonthehardway org ,yes
searched for learn python the hard way,yes
visited regular expression   wikipedia,yes
searched for regular expressions,yes
searched for go,yes
searched for dashboard aerdata loc landing,yes
searched for argentina,no
visited tcs alumni portal,no
searched for tcs alumni portal,no
searched for opt meaning,no
visited hdfc bank,no
searched for hdfc netbanking,no
searched for dashboard aerdata loc landing,no
visited outlook com smtp settings necessary to send email   lifewire,no
searched for smtp server in outlook,no
visited send outlook email via python    stack overflow,no
visited https   medium freecodecamp org send emails using code  fcea df  f,yes
searched for code to send email to outlook in python,yes
visited using python to send email   pythonforbeginners com,yes
searched for code to send email in python,yes
searched for swagat restaurant amsterdam,no
visited how to sit at a computer   dohrmann consulting,no
searched for sitting posture in office,no
visited tableau unveils new subscription pricing model for data       geekwire,yes
searched for tableau subscription pricing,yes
visited infogram  create infographics  reports and maps,yes
searched for infogram,yes
visited what is data literacy    definition from whatis com,yes
visited https   www qlik com us services training data literacy program,yes
visited data literacy   wikipedia,yes
searched for data literacy,yes
searched for olympics in netherlands,no
searched for uk country code,no
visited field data types   elasticsearch reference         elastic,yes
searched for how to know data type in elasticsearch,yes
visited promoted jobs in your job search results   linkedin help,no
searched for promoted job meaning in linkedin,no
visited https   backbase com ,no
searched for backbase amsterdam,no
visited dimensional modeling   wikipedia,no
searched for kimball data models,no
searched for keystone data models,no
searched for b b meaning,no
searched for telangana election results     ,no
searched for dwh company netherlands,no
searched for dwh stables netherlands,no
searched for dwh,no
searched for hp,no
visited amsterdam  nederland   leaseweb,no
searched for leaseweb amsterdam,no
searched for himachal pradesh,no
searched for nagpur famous for,no
searched for nagpur,no
searched for capital of chattisgarh,no
searched for capital of punjab,no
searched for capital of madhya pradesh,no
searched for capital of andhra pradesh,no
visited http   knowindia gov in states uts ,no
searched for indian state names,no
searched for number of indian states,no
visited https   www ibm com employment nl nl ,no
searched for ibm netherlands careers,no
searched for ibm netherlands,no
visited https   www ibm com nl nl ,no
searched for soft skills list,no
visited   questions you should absolutely ask an interviewer   glassdoor,no
searched for   questions to ask in a job interview,no
visited https   www mobiquityinc com ,no
searched for mobiquity amsterdam,no
searched for what,no
visited https   www ailab microsoft com challenge,no
searched for microsoft ai challenge,no
searched for google translate,no
visited http   teamexpat com ,no
searched for team expat netherlands,no
searched for naveen sontineni,no
visited vacancies   werken bij de bijenkorf,no
searched for de bijenkorf amsterdam jobs,no
visited quby  outsmarting energy,no
searched for quby amsterdam,no
visited william alexander  about us,no
searched for william alexander recruitment ltd,no
visited isense ict professionals  ict detachering,no
searched for isense ict professionals,no
visited tomtom careers,no
searched for tomtom careers,no
searched for naveen sontineni,no
searched for kavacham producer naveen sonthineni,no
visited https   m youtube com watch v hn   grhdfy,no
searched for antariksham,no
visited tik tik tik   official tamil trailer  k   jayam ravi  nivetha pethuraj    ,no
searched for tic tic tamil movie,no
searched for tic tic,no
searched for cism certified information security manager,no
visited ict vacatures amsterdam   isense ict professionals,no
searched for iscense amsterdam,no
visited https   www hcltech com campaign careers in netherlands,no
searched for hcl netherlands jobs,no
visited https   www hcltech com campaign careers in netherlands,no
searched for hcl netherlands careers mainframe,no
visited introduction to word embeddings  introduction   by joshua kim    ,yes
searched for embedding,yes
visited embedding   wikipedia,yes
searched for embeddings meaning,yes
visited http   vedasoftwaresolutions com ,yes
visited splendid it global consulting ltd   overview  free    ,no
searched for veda software solutions uk limited,no
visited https   stackoverflow com questions         no connection could be made because the target machine actively refused it              ,yes
visited no connection could be made because the target machine actively    ,yes
searched for no connection could be made because the target machine actively refused it,no
visited openssl errors and rails   certificate verify failed   railsapps,no
visited https   github com  google extract  cbcde ec ab  fe  google e  adobe apiplatform  google e  user sync py  google e  issues  google e      ,no
visited python requests ssl error   certificate verify failed   stack overflow,yes
searched for certificate verify failed,no
visited https   stackoverflow com questions          bad request when accessing api endpoint programatically in python rq  ,yes
searched for python couldn t access api,yes
visited firewall and other questions   elasticsearch   discuss the elastic stack,yes
visited unable to connect to elasticsearch at http   localhost         ,yes
searched for how to know if firewall is blocking elasticsearch,yes
visited firewall   block port        elasticsearch   discuss the elastic stack,yes
visited windows     allow block apps in firewall   technipages,yes
visited windows firewall blocking connections   globalscape,yes
searched for firewall blocking,yes
visited network settings   elasticsearch reference         elastic,yes
searched for firewall blocking elasticsearch,yes
visited curl      failed connect to localhost       connection refused    ,yes
visited https   github com  google extract  cbcde ec ab  fe  google e  smile sa  google e  elasticsuite  google e  issues  google e     ,yes
visited https   stackoverflow com questions          connection refused error on elastic search,yes
searched for curl      failed to connect to localhost port       connection refused,no
visited perl  curl      protocol  http not supported or disabled in libcurl    ,no
searched for curl      protocol   http  not supported or disabled in libcurl,no
visited https   www elastic co guide en elasticsearch guide   x running elasticsearch html,no
visited https   www elastic co guide en elasticsearch guide current running elasticsearch html,no
searched for how to check if elasticsearch is running,no
visited https connection using curl from command line   stack overflow,no
searched for how to use curl to test connection,no
visited https   github com  google extract  cbcde ec ab  fe  google e  elastic  google e  elasticsearch py  google e  issues  google e      ,no
searched for urllib  exceptions newconnectionerror   urllib  connection httpconnection object at  x      a e     d    failed to establish a new connection,no
visited getting started with elasticsearch python    part one   by valeria    ,yes
visited https   www elastic co guide en elasticsearch client python api current ,yes
visited elasticsearch tutorial for beginners using python   nitin panwar    ,yes
searched for python connect to elasticsearch,yes
visited introduction install plugin head and kopf for elasticsearch        ,yes
visited elasticsearch head   blog fossasia org,yes
searched for elasticsearch head tutorial,yes
searched for elasticsearch queries,yes
searched for elasticsearch queries,yes
visited match all query   elasticsearch reference         elastic,yes
searched for elasticsearch match all by query,yes
visited delete by query api   elasticsearch reference         elastic,yes
searched for elasticsearch delete by query,yes
searched for replace tab with pipe in a list of strings python,yes
visited how to replace tabs in a string    stack overflow,yes
searched for replace tab with pipe in list python,yes
visited https   stackoverflow com questions          csv error iterator should return strings not bytes did you open the file in         ,yes
visited csv error  iterator should return strings  not bytes   stack overflow,yes
searched for iterator should return strings  not bytes  did you open the file in text mode  ,yes
visited convert tab delimited text file to csv using python   youtube,yes
searched for convert tab text file to pipe delimited in python,yes
visited https   stackoverflow com a         ,no
searched for convert tab delimited text file to pipe delimited in python,yes
visited convert csv file to pipe delimited file in python   stack overflow,yes
searched for convert tab delimited file to pipe delimited in python,yes
searched for columns to text in excel,no
visited work permit in the netherlands   iamexpat,no
searched for what is work permit do i have in netherlands,no
searched for what is work permit in singapore,no
visited valtech careers and employment   indeed com,no
visited https   www naukri com valtech jobs careers      ,no
visited valtech reviews   glassdoor,no
visited valtech interview questions   glassdoor,no
visited career   valtech,no
searched for why do you want to work in valtech,no
visited https   www linkedin com company nexgeno,no
visited https   nexgeno com ,no
searched for nexgeno,no
visited https   stackoverflow com questions          reading a file without newlines,no
searched for read text file without  n python,yes
visited how to add a new line in a text file using python without  n   stack    ,yes
searched for convert list to text file without an empty line python,yes
visited writing a list to a file with python   stack overflow,yes
searched for convert list to text file python,yes
visited https   stackoverflow com questions          extract first item of each sublist in python         ,yes
searched for select first value from list in python,yes
visited https   stackoverflow com questions          extract first item of each sublist in python,yes
searched for select first value from list as a list in python,yes
visited https   stackoverflow com questions         how to concatenate two lists in python,yes
searched for append   lists in python,yes
searched for smoke testing,no
searched for intuitive meaning,no
searched for naveen sontineni,no
searched for kavacham producer naveen sonthineni,no
searched for kavacham producer telugu movie producer,no
