title,Related
visited https   en m wikipedia org wiki dear comrade,no
searched for dear comrade,no
searched for ams  abn,no
defined shortlisted,no
visited padhai   ai courses by iit madras faculty,yes
searched for padhai,yes
visited welcome to apspdcl,no
searched for southern power distribution company of a p ltd  apspdcl ,no
visited https   economictimes indiatimes com articleshow          cms,no
searched for today s stock market india,no
searched for today s stock market,no
searched for nse  lichsgfin,no
searched for irctc stock price,no
visited welcome to apspdcl,no
searched for southern power distribution company of a p ltd  apspdcl ,no
visited python windowserror   error      the filename  directory name  or    ,yes
searched for  winerror      the filename  directory name  or volume label syntax is incorrect,yes
visited python   os path dirname   method   geeksforgeeks,yes
visited os path   common pathname manipulations   python          ,yes
visited       os path   common pathname manipulations   python           ,yes
searched for os path dirname,yes
searched for os path abspath,yes
searched for ttp                  ,yes
visited upload files using python and flask   youtube,yes
searched for upload files using python flask,yes
searched for upload files using python flask,yes
visited assertionerror  view function mapping is overwriting an existing    ,yes
searched for view function mapping is overwriting an existing endpoint function  upload file,yes
visited flask configuration files   learning flask ep       pythonise com,yes
visited configuration handling   flask documentation       x ,yes
searched for configuration settings of flask object ,yes
visited chrome bookmarks recovery tool   github pages,no
visited how to recover accidentally deleted bookmarks in chrome   firefox,no
searched for how to recover lost bookmarks in chrome,no
visited uploading files   flask documentation      x ,no
visited flask     file uploading   tutorialspoint,yes
searched for efpac summary,no
searched for file uploading using flask,yes
visited whatsapp web,no
searched for whatsapp web,no
visited an in depth look at the netherlands      ruling   i amsterdam,no
visited frequently asked questions about the     ruling   broadstreet,no
searched for what if i apply     ruling after   months,no
searched for google,no
visited chrome won t open  can t uninstall   google chrome community,no
searched for problem uninstalling google chrome,no
visited can t attach and save files from chrome    browse folder dialog    ,no
visited edge chromium   download file   open vs  save option pop up    ,no
searched for google chrome open  save file dialog disappears,no
visited how to fix windows installer package problem   chrome remote    ,no
searched for there is a problem with this windows installer package chrome,no
searched for chrome open dialog doesn t work,no
visited how to uninstall chrome on windows      quora,no
searched for how to uninstall google chrome windows   ,no
visited chrome save file dialogs stop working after an arbitrary period of    ,no
searched for file open dialog disappear in google chrome,no
visited https   github com  google extract  cbcde ec ab  fe  google e  jquery  google e  jquery mobile  google e  issues  google e       ,no
searched for file open dialog disappear in chrome,no
searched for chrome file open dialog doesn t work,no
visited https   support google com chrome forum aaaap kn b cogcn shbwm  hl en,no
visited google chrome   download the fast  secure browser from google,no
searched for download    bit chrome,no
searched for update google chrome,no
visited  browse    open file    select files  dialog not working   super user,no
visited opening modal dialog window is not working in chrome   stack    ,no
visited google chrome   open dialog box cause chrome to freeze or    ,no
searched for chrome open dialog,no
searched for fix file open dialog issue chrome,no
visited how to fix file explorer problems in windows      windows report,no
visited fix  file download dialog box is not appearing in windows   ,no
visited open  save dialogs not working after      update    microsoft    ,no
visited crash when open a file dialog on windows    creators update    ,no
searched for fix file open dialog issue windows   ,no
defined spawning,no
visited fix file dialog prompts not spawning in the foreground in windows    ,no
visited open and save as dialog boxes not working   microsoft community,no
visited reset open and save as common item dialog boxes in windows    ,no
searched for fix save dialog issue windows   ,no
visited reset open and save as dialog in windows      winaero,no
visited upload problems   windows    forums,no
searched for windows    file upload problem,no
searched for problem with uploading files in windows,yes
visited html editors   w schools,yes
searched for how to create a html file,yes
visited flask app configuration   python on the web   learning flask series    ,yes
visited setting and retrieving environmental variables in flask applications    ,yes
visited configuration handling   flask documentation      x ,yes
searched for how to change flask environment variables,yes
visited https   github com  google extract  cbcde ec ab  fe  google e  paddlepaddle  google e  visualdl  google e  issues  google e      ,yes
visited flask at first run  do not use the development server in a production    ,yes
searched for environment  production warning  do not use the development server in a production environment  use a production wsgi server instead ,yes
visited uploading files   flask documentation      x ,yes
visited flask     file uploading   tutorialspoint,yes
visited upload a file with python flask   python tutorial,yes
searched for python flask code to upload documents,yes
visited one x   credential lifecycle management,yes
visited learning on the blockchain  what is one x    theblockchainu    ,yes
searched for one x,no
searched for ril stock price,no
searched for irctc stock price,no
visited https   en m wikipedia org wiki brahmanandam filmography,no
searched for brahmanandam carrer  st movie,no
visited https   en m wikipedia org wiki brahmanandam,no
searched for brahmanandam  st movie,no
searched for why guava fruit should not be shared,no
searched for why guavua should not be shared,no
searched for average indian female height,no
searched for average indian male height,no
searched for average netherlands male height,no
searched for meters to feet,no
searched for varun tej height,no
searched for pragya jaiswal,no
visited buy lg    inch tv    coolblue   before        delivered tomorrow,no
visited    inch      cm  lg tv kopen  alle tv s online   bol com,no
searched for lg smart tv   inch,no
visited lufthansa  book a flight now and discover the world,no
searched for flights from amsterdam to   on jun         returning jun         ,no
searched for lufthansa,no
visited pandas dataframe sort values   pandas       documentation,yes
searched for sort values,no
searched for irctc stock price,no
visited exchange rate israeli shekel to euro  currency calculator    x rates,no
searched for ila to eur,no
visited https   en m wikipedia org wiki dangal  soundtrack ,no
searched for dangal singars,no
visited the aviation herald,no
searched for aviation herald,no
defined closure,no
visited hackathon guide,no
searched for hackathon opening session agenda,no
visited hackathon opening session by mike   youtube,no
searched for hackathon introduction session,no
searched for avian share price,no
searched for boeing share price,no
searched for tsla,no
searched for ral    ,no
searched for one   track,no
viewed one track b v ,no
visited cet to ist converter   convert central time to india time   world    ,no
searched for cet to ist,no
visited pandas dataframe fillna   pandas       documentation,yes
searched for fillna,yes
searched for nse  lichsgfin,no
searched for indian prime minister in     ,no
searched for nyse  ba,no
visited pandas dataframe drop duplicates   pandas       documentation,yes
searched for drop duplicates python,yes
visited pst to cet converter   convert pacific time to central time   world    ,no
searched for pst to cet,no
visited current local time in amsterdam  netherlands   time and date,no
searched for netherlands time zone ,no
visited gmt   offset  countries and regions,no
searched for gmt  ,no
searched for nyse  ba,no
searched for nyse  ba,no
searched for andhra pradesh flag colour,no
searched for nse  tatamotors,no
searched for nse  lichsgfin,no
searched for nse  l tfh,no
searched for nse  bankbaroda,no
searched for jockey share price,no
searched for nasdaq  tsla,no
searched for khaidi number     telugu movie,no
searched for bhanusree telugu actresses,no
searched for bhanusree telugu,no
searched for bhanusree,no
searched for kajal agarwal,no
searched for nyse  ba,no
visited https   support office com en us article recall or replace an email message that you sent      f   d         b f   c    a   a ,no
searched for delete the sent mail from outlook,no
searched for nse  pnb,no
searched for nse  bankbaroda,no
searched for nyse  ba,no
searched for nasdaq jpm,no
searched for nasdaq xom,no
searched for nasdaq exxonmobil,no
searched for nasdag exa,no
searched for nasdaq wba,no
searched for what does sonarqube do,no
visited gichsgfin share price target   gic housing finance limited nse    ,no
searched for nse  gichsgfin,no
visited http   www google com preferences hl en nl,no
searched for time series plots,no
searched for india demographics profile     ,no
searched for netherlands population age wise,no
searched for mumbai area,no
searched for nse pageind financials,no
searched for jockey share price,no
visited uitslagen   benieuwd naar jouw uitslag van de afgelopen edities,no
searched for tcs amsterdam marathon      results,no
defined ploughing,no
searched for nyse  ba,no
searched for atomic habits,no
visited lufthansa  book a flight now and discover the world,no
searched for lufthansa,no
searched for flights from amsterdam to   on jun         returning jun        ,no
visited pst to cet converter   convert pacific time to central time   world    ,no
searched for pst to cet,no
searched for nasdaq  tsla,no
searched for nyse  ba,no
searched for are powerbeats pro noise cancelling,no
searched for nyse  ba,no
searched for testimony,no
visited https   github com  google extract  cbcde ec ab  fe  google e  jupyter  google e  jupyter core  google e  issues  google e      ,yes
visited https   github com  google extract  cbcde ec ab  fe  google e  jupyter  google e  notebook  google e  issues  google e       ,yes
searched for cannot import name  secure write  from  jupyter core paths ,yes
searched for nse  gichsgfin,no
searched for nse  lichsgfin,no
viewed european federation of psychologists  associations  efpa ,no
searched for nse  lichsgfin,no
visited video conferencing   start a poll in cisco webex meetings,no
visited take a poll,no
visited video conferencing   poll attendees in cisco webex training,no
visited video conferencing   manage polls in cisco webex events,no
searched for audience poll in webex meeting,no
searched for boeing share price,no
searched for dmart share price,no
searched for jockey share price,no
searched for mrf tyres share price,no
searched for nse  lichsgfin,no
visited the    best online survey apps in        zapier   the ultimate    ,no
visited create an online survey and get results fast    doodle,no
visited create a web survey   gather opinions or plan meetings   doodle,no
searched for create survey to gather opinions,no
visited how to fix the   most common survey problems   surveymonkey,no
searched for create survey to shortlist things,no
visited polly   survey software built for slack and microsoft teams,no
searched for polly,no
searched for device to tell the live opening timings,no
visited how to file a patent in   easy steps   inc com,no
visited filing a patent application in the netherlands   rvo nl,no
searched for how to file a patent,no
searched for mindvalley ceo,no
visited age calculator   calculator net,no
searched for age calculator,no
visited https   en m wikipedia org wiki vishen lakhiani,no
visited raashi khanna   wikipedia,no
searched for rashi khanna,no
visited samsung ms  f   tak en   coolblue   voor      u  morgen in huis,no
searched for solo magnetron     liter  ms  f   tak,no
visited whirlpool mwp     b   coolblue   before        delivered tomorrow,no
visited whirlpool mwp     b magnetron      liter       watt   whirlpool,no
searched for mwp     b,no
visited whirlpool microgolfoven  mwp     sb  microgolfoven,no
visited whirlpool mwp     sb   solo magnetron   bol com,no
searched for mwp     sb,no
visited whirlpool mcp       bl   coolblue   before        delivered    ,no
searched for mcp     bl,no
searched for aeg vacuum cleaner,no
visited free cloud storage for personal use   google drive,no
searched for google drive,no
visited lockdown     guidelines   rules  up  delhi  haryana  rajasthan    ,no
searched for lockdown    ,no
visited google says that the majority of its employees will work from home    ,no
visited google expects its staff to work from home until      and it s not    ,no
searched for google work from home model,no
searched for google,no
visited million   crore   lakh conversion calculator,no
searched for convert billion to crore,no
searched for reliant meaning,no
visited https   www vfsglobal com en individuals ,no
searched for vfs global,no
searched for amazon prime subscription netherlands,no
searched for tag cloud with frequency,no
searched for convert meter to feet,no
searched for allu arjun height,no
searched for nithya menon height,no
visited boost search relevance for tag based social image retrieval   ieee    ,yes
visited azure cognitive search   microsoft docs,yes
searched for tagging document benefits for search retrieval,yes
visited exploring social annotation tags to enhance information retrieval    ,yes
visited http      pc    csie ntnu edu tw presentation          a   social   inverted   index   for   social tagging based   information   retrieval pdf,yes
visited philips speedpro fc          coolblue   before        delivered    ,no
searched for fc         ,no
visited https   www bol com nl p philips powerpro duo fc        steelstofzuiger   in                    ,no
visited philips speedpro max aqua fc          coolblue   before          ,no
searched for fc         ,no
visited philips speedpro max series      xc          coolblue   before    ,no
searched for xc       ,no
visited powerpro duo   in   steelstofzuiger met powercyclone fc           ,no
searched for fc         ,no
searched for famous telugu serials,no
visited trademark research   brand protection services   corsearch,no
viewed corsearch europe,no
searched for corsearch,no
visited http   citeseerx ist psu edu viewdoc download doi                 rep rep  type pdf,no
visited phrase based search experiments in the hard track,no
visited doc tags automatically create accurate contextual document tags,yes
visited the role of tags in information retrieval interaction   deep blue,yes
visited a survey of tag based information retrieval   request pdf,yes
searched for tagging document search retrieval accuracy,yes
visited evaluation measures  information retrieval    wikipedia,yes
searched for document search retrieval accuracy,yes
visited smart document organization  find docs faster with tags,yes
visited tagging best practices   awsstatic,yes
visited the top   best practices for document management in sharepoint    ,yes
searched for document tagging best practices,yes
visited add tags to work items   azure boards   microsoft docs,yes
searched for use of tagging in vsts,yes
visited better to organize personal information by folders or by tags   the    ,yes
visited the benefits of choosing metadata v  folders in sharepoint    ,yes
visited forget folders  the best ways to organize your files with tags and    ,yes
searched for advantages of tagging in document search,yes
visited car loan interest rate   compare car loan rates jul     ,no
searched for car loan interest rates india,no
visited car loan emi calculator   hdfc bank,no
searched for hdfc car loan emi calculator,no
visited huurwoningen hoofddorp   huizen te huur in hoofddorp  funda ,no
searched for funda hoofddorp huur,no
searched for oneven hoofddorp funda,no
visited https   www oozo nl bedrijven haarlemmermeer hoofddorp en omgeving graan voor visch zuid        vereniging van eigenaars van het gebouw de waker aan de peperkers   tot en met    oneven nummers te ijmuiden,no
searched for oneven hoofddorp,no
visited verleende omgevingsvergunning  duinpad       oneven  te    ,no
visited zoek huizen en appartementen te koop in nederland  funda ,no
searched for funda,no
visited meer makelaar  home,no
searched for meer makelaar,no
searched for pnb share price,no
visited bind   fails with windows socket error         stack overflow,no
searched for socket error      ,no
searched for mrf tyres share price,no
searched for mrf tyres wiki,no
searched for mrf tyres,no
searched for  m india,no
searched for jockey share price,no
visited lufthansa  book a flight now and discover the world,no
searched for flights from amsterdam to   on may          returning jun        ,no
searched for lufthansa,no
searched for nyse  ba,no
visited https   github com  google extract  cbcde ec ab  fe  google e  keras team  google e  keras  google e  issues  google e       ,yes
visited https   github com  google extract  cbcde ec ab  fe  google e  keras team  google e  keras  google e  issues  google e       ,yes
visited input shape in keras  this loss expects targets to have the same    ,yes
searched for while using as loss  binary crossentropy   this loss expects targets to have the same shape as the output ,yes
visited how to fix  attributeerror  module  tensorflow  has no attribute    ,yes
visited https   github com  google extract  cbcde ec ab  fe  google e  keras team  google e  keras  google e  issues  google e        ,yes
visited https   github com  google extract  cbcde ec ab  fe  google e  keras team  google e  keras  google e  issues  google e        ,yes
searched for module  tensorflow  has no attribute  get default graph ,yes
visited pandas hdfstore put   pandas       documentation,yes
searched for hdfstore pandas,yes
visited  h  to csv   kaggle,yes
visited conversion hdf  to csv   hdf    hdf forum,yes
visited converting hdf  to csv or tsv files   stack overflow,yes
visited grootste hardloopevenement van nederland   dam tot damloop,no
searched for dam to dam run,no
visited inschrijving      open    tcs amsterdam marathon,no
searched for amsterdam marathon     ,no
searched for e is,no
searched for e,no
visited what is the difference between stemming and lemmatization ,yes
visited stemming and lemmatization in python   datacamp,yes
searched for stemming and lemmatization example,yes
visited install spacy   spacy usage documentation,yes
searched for install spacy in anaconda,yes
visited https   github com  google extract  cbcde ec ab  fe  google e  explosion  google e  spacy  google e  issues  google e       ,yes
searched for no module named  spacy ,yes
visited ceoworld magazine rankings   ceoworld magazine,no
searched for ceo world magazine rankings,no
searched for ceo world magazine,no
searched for royal dutch shell headquarters,no
searched for royal dutch shell,no
visited seaborn regplot   seaborn        documentation,yes
searched for line regplot  ,yes
visited seaborn lmplot   seaborn        documentation,yes
searched for lmplot  ,yes
visited tutorial  quickstart   textblob        documentation,yes
searched for blob sentiment,yes
visited python strftime     datetime to string   programiz,yes
searched for x strftime,yes
visited how to calculate the adjusted coefficient of determination   dummies,yes
searched for adjusted r squared formula,yes
visited a new svd approach to optimal topic estimation   arxiv,yes
searched for topic term matrix in svd,yes
visited topic modeling   text vec,yes
searched for topic term matrix in lda,yes
searched for divisibility rule of  ,yes
searched for r squared value cannot tell about the importance of variable,yes
searched for support in decision tree,yes
visited a guide to decision trees for machine learning and data science    ,yes
searched for support in decision tree with increase in number of features,yes
searched for ispunct python sacpy,yes
visited https   kite com python docs nltk tweettokenizer,yes
searched for from nltk tokenize import tweettokenizer,yes
visited gensim  models keyedvectors   store and query word vectors,yes
searched for from gensim         import keyedvectors,yes
visited sklearn metrics roc curve   scikit learn        documentation,yes
searched for sklearn metrics roc curve,yes
visited      datetime   basic date and time types   python           ,yes
searched for weekday   python,yes
visited sensitivity and specificity   wikipedia,yes
searched for a good model is having true positive rate low,yes
searched for a good model is having tpr low,yes
searched for student s t distribution  as degree of freedom increases ,yes
visited sklearn metrics f  score   scikit learn        documentation,yes
searched for sklearn f  score multiclass,yes
visited http   www sfu ca  dmackey chap         correlation pdf,yes
searched for pearson s correlation coefficient of ellipse,yes
searched for pearson s correlation coefficient,yes
searched for box cox transformed data,yes
visited sigmoid function   wikipedia,yes
visited tanh is a rescaled logistic sigmoid function   ai and social science    ,yes
searched for range of sigmoid function,yes
searched for does decision tree handle multi correlation ,yes
searched for anova testing is based on the formula of student s t,yes
searched for anova testing is based on the formula of student s t testing,yes
visited sklearn feature extraction dictvectorizer   scikit learn           ,yes
searched for from sklearn     import dictvectorizer,yes
visited why is    equal to   and not       stack overflow,yes
searched for not not     not not     not   ,yes
visited correlation coefficient definition   investopedia,yes
searched for correlation coefficient formula using mean and standard deviation,yes
searched for correlation coefficient formula,yes
searched for aic should be high or low,yes
visited how to use python s xrange and range   python central,yes
searched for difference between range and xrange,yes
searched for unnecessary splits in decision tree model,yes
visited interpolations for imshow matshow   matplotlib       documentation,yes
searched for interpolation matplotb plyplot imshow,yes
visited http   www sjsu edu faculty gerstman statprimer t table pdf,yes
searched for t table,yes
searched for from scipy           import distance,yes
visited machine learning   multiclass classification with imbalanced    ,yes
visited http   scholar google nl scholar q model predictions classes multi class hl en as sdt   as vis   oi scholart,yes
searched for model predictions classes multi class,yes
visited how to interpret model predict classes       google groups,yes
visited http   faroit com keras docs       models sequential ,yes
searched for model predict classes,yes
visited the binomial distribution   math is fun,yes
visited http   www santarosa edu  ylin math   notes binomial distribution htm,yes
searched for what is the standard deviation of the bernoulli distribution for the event of tossing a fair coin,yes
visited combinations calculator  ncr    calculator soup,yes
searched for combinations calculator,yes
visited what is the difference and relationship between the binomial and    ,yes
searched for link between the independent variables and the bernoulli distribution,yes
visited tf keras preprocessing sequence pad sequences   tensorflow core    ,yes
searched for sequence pad sequences,yes
visited python operator   types of operators in python   dataflair,yes
searched for python operator,yes
searched for word embeddings model by using dimensionality reduction,yes
searched for embeddings model by using dimensionality reduction,yes
searched for embeddings model by constructing a co occurrence matrix and using dimensionality reduction,yes
searched for embeddings model learns by constructing a co occurrence matrix and using dimensionality reduction,yes
searched for treatment and control groups,yes
searched for knn with euclidean distance and manhattan distance,yes
visited analysis of mtcars data using regression models   aws,yes
searched for independent variable is the most important predictor of mpg mtcars data,yes
searched for ratio between the difference between two groups and the difference within the groups ,yes
searched for sklearn confusion matrix false positive rate,yes
searched for sklearn confusion matrix true positive rate,yes
visited example of confusion matrix in python   data to fish,yes
visited confusion matrix in machine learning with python   python course eu,yes
visited demystifying  confusion matrix  confusion   by salrite   towards    ,yes
visited confusion matrix in machine learning   geeksforgeeks,yes
searched for sklearn confusion matrix formulas,yes
searched for sklearn confusion matrix,yes
visited quick p value from z score calculator,yes
visited http   resources esri com help     arcgisdesktop com gp toolref spatial statistics toolbox what is a z score what is a p value htm,yes
searched for z score calculation from p value,yes
visited sklearn metrics classification report   scikit learn           ,yes
