title,Related
visited download your google search history   albertine meunier,no
visited how to download a copy of everything google knows about you,no
visited https   support google com accounts answer dupm fake answer id         hl en,no
visited how to download copy of google search history   business insider,no
searched for can i download my google activity ,no
visited welcome to my activity,no
searched for google history,no
visited facebookresearch detectron   detectron  is fair s next       github,yes
searched for detectron ,yes
visited rgv world theatre  watch rgv powestar movie   ram gopal    ,no
searched for rgv world cinema,no
viewed cineworld beverwijk,no
visited https   support google com chromecast answer dupm fake answer id         hl en,no
searched for how to setup chromecast,no
visited https   support google com chromecast answer dupm fake answer id         co genie platform  dandroid hl en,no
searched for how to reset chromecast,no
viewed inox r   world,no
searched for r world cinema,no
searched for sensex,no
searched for google finance,no
searched for ajanta pharma stock price,no
searched for nse  reliance,no
searched for sharepoint,no
visited gaslicht com  vergelijk energie van alle leveranciers,no
searched for gaslicht,no
viewed gaslicht com   energie vergelijken,no
visited ziggo  je aanbieder voor televisie  internet en bellen   altijd    ,no
searched for ziggo,no
visited waternet  schoon water voor amsterdam en omgeving,no
searched for waternet,no
searched for philips hue manufacturing country,no
searched for philips hue made in ,no
searched for philips hue manufacturer,no
visited welcome to prime video,no
searched for amazon prime video,no
searched for mercedes new models interior,no
searched for mercedes new models,no
searched for finance,no
searched for yahoo mail,no
visited deep learning vs neural networks  difference between deep    ,yes
searched for is neural network deep learning,yes
visited evaluate model   ml studio  classic    azure   microsoft docs,yes
searched for azure ml evaluate model,yes
searched for nse  reliance,no
searched for google finance,no
visited companies apply for second round of coronavirus furlough support    ,no
visited unions press cabinet not to scrap fine for laying off furloughed    ,no
searched for are furloughs possible in netherlands,no
searched for furlough in netherlands,no
searched for hue lamp,no
visited send money online   xoom  a paypal service,no
searched for xoom paypal,no
searched for reliance share price,no
searched for euro to inr,no
searched for dollar to euro,no
searched for how to use get and set methods in java,yes
searched for python get and set methods,yes
searched for why python treats variables differently than oops,yes
searched for private and public variables in python,yes
searched for boeing stock price,no
searched for google finance,no
searched for udacity nanodegree visual challenge,no
searched for bs  vs bs  in europe ,no
searched for authors synonym,no
searched for statistics of reading articles based on time,yes
visited the time zone converter,no
searched for timezone converter,no
visited creating a resource group   techlibrary   juniper networks,no
visited how to use azure resource groups  a simple explanation   otava,yes
visited manage resource groups   azure portal   azure resource manager    ,yes
searched for what is a resource group in azure,yes
visited microsoft azure  cloud computing services,yes
searched for microsoft azure,yes
visited regularization of a final value problem for a nonlinear biharmonic    ,yes
visited optimization and regularization of nonlinear least       citeseerx,yes
searched for regularization for nonlinear boundaries,yes
visited regularization methods for nonlinear ill posed problems with    ,yes
visited generalization and regularization in nonlinear learning systems  ,yes
visited logistic regression  nonlinear features  regularization   carnegie    ,yes
searched for finance,no
visited http   www demaautos nl ,no
viewed dema auto s b v ,no
visited pricewise in english   compare now   pricewise nl,no
viewed pricewise,no
visited weer     daagse weersverwachting  buien radar   www weeronline nl,no
searched for weeronline,no
visited home loan emi calculator   hdfc ltd,no
searched for loan calculator india,no
searched for reliance gdr stock price,no
searched for nse  reliance,no
searched for google finance,no
visited technische gegevens  bmw   serie      i centennial executive        ,no
searched for    i centennial executive vs     sport,no
searched for google translate,no
searched for countd function tableau,yes
visited bmw    i vs    i   review of price  specs and fuel consumption    ,no
visited what s the difference between the     and the           wheelsology    ,no
searched for bmw     vs    ,no
searched for finance,no
searched for havenstraat   ,no
searched for kia sonet,no
searched for google finance,no
visited eurocars   vele auto s op voorraad ,no
viewed eurocars,no
searched for eurocars,no
searched for urocars,no
searched for google translate,no
visited clustering of time series data   intechopen,yes
searched for clustering time series data,yes
searched for weighted auc vs auc,yes
searched for auc weighted metric,yes
visited tf keras metrics auc   tensorflow core v     ,yes
visited multi class auc metrics and weighted alternatives   ku leuven,yes
visited weighted auc metric  updated    kaggle,yes
visited what does auc stand for and what is it    cross validated,yes
visited how to compute a weighted auc    cross validated,yes
visited what is the difference between area under roc and weighted area    ,yes
visited analysis on weighted auc for imbalanced data learning through    ,yes
visited definition of the weighted roc curve   rdrr io,yes
visited weighted area under the receiver operating characteristic curve    ,yes
searched for weighted auc formula,yes
visited sklearn metrics roc auc score   scikit learn        documentation,yes
searched for weighted auc sklearn,yes
visited oozo nl  weten wat er in jouw buurt of straat gebeurt ,no
searched for oozo nl,no
searched for oozoo,no
visited https   www ing nl particulier ,no
searched for ing,no
visited huispedia   neem zelf de regie over je woning,no
searched for huispedia,no
searched for what is the diagonal in roc curve represent,yes
visited explanation of roc curves   getthediagnosis org,yes
visited receiver operating characteristic   an overview   sciencedirect    ,yes
searched for what is the diagonal in roc curve below,yes
searched for regression metrics in machine learning which one to use,yes
searched for nse  reliance,no
searched for google finance,no
searched for nse  federalbnk,no
searched for nse  tatamotors,no
searched for finance,no
searched for google finance,no
visited https   www ndtv com business international flights spicejet to operate first long haul flight to amsterdam on august           amp   akamai rum off,no
searched for spicejet india to amsterdam,no
visited spicejet   flight booking for domestic and international  cheap air    ,no
searched for spicejet booking,no
searched for flights from blr to ams on aug        ,no
visited flights   google,no
searched for google flights,no
visited module   transfer learning   ai school,yes
searched for transfer learning in azure machine learning,yes
used google play services,no
searched for tran,no
visited azure synapse analytics   microsoft azure,yes
searched for azure synapse analytics,yes
visited cozee homes  managed homes  apartments  villas  houses  flats    ,no
visited main page   apnnaghar best property management services    ,no
visited flats for rent in bangalore      verified apartments   nestaway,no
searched for rent houses companies in bangalore,no
visited home   wisk,no
searched for wisk,no
viewed wisk aero,no
visited matternet,no
searched for matternet,no
visited skygrid   next gen airspace management for drones,no
searched for skygrid,no
searched for office     mfa,no
searched for reliance share price,no
searched for reliance gdr stock price,no
searched for amara raja share price,no
visited tableau certification,yes
visited classroom training   fundamentals   tableau software,yes
searched for tableau desktop   fundamentals certification,yes
searched for google finance,no
searched for reliance gdr stock price,no
searched for reliance share price,no
searched for reliance gdr,no
searched for finance,no
visited manipulate time with these powerful    time management tips,no
searched for time management tips,no
visited sololearn  learn to code for free ,no
searched for sololearn,no
searched for hello group iii   how are you doing  shall we make a group chat and start discussing ,no
visited walking for weight loss    tips to burn fat   medical news today,no
searched for amount of walk required for weight loss,no
searched for google translate,no
searched for google finance,no
visited rigd   reliance industries ltd  gdr overview   marketwatch,no
searched for reliance gdr,no
viewed degiro,no
searched for snap share price,no
searched for instagram share price,no
searched for apple share price,no
searched for microsoft share price,no
visited tableau   data blending   tutorialspoint,yes
searched for blending in tableau,yes
visited about extract upgrades from  tde to  hyper   tableau,yes
searched for  hyper tableau,yes
searched for what is a calculated field in tableau,yes
searched for in data pane of tableau why are  italic names,yes
searched for in data pane of tableau why ae  italic names,yes
searched for in data pane italic names tableau,yes
searched for in data pane italic names tableaus,yes
visited online oracle training   oracle fusion dba training  oracle cloud    ,yes
searched for k  academy,no
viewed k  academy,no
visited google calendar,no
searched for google calendar,no
visited india s  r  dips to       active covid cases could now be     lakh    ,no
visited covid    spread  india s covid    transmission rate has increased    ,no
searched for reproduction rate of coronavirus in india,no
searched for what does coefficient of determination mean,yes
visited semiya payasam recipe   swasthi s recipes,no
searched for payasam,no
visited codecombat   coding games to learn python and javascript    ,yes
searched for python games,yes
visited language understanding  luis  documentation   azure cognitive    ,yes
searched for microsoft learn for luis,yes
visited how to create your first chatbot using azure bot services   dzone    ,yes
searched for how to create a chatbot from scratch using azure,yes
visited why was sonia gandhi not elected as the prime minister of india    ,no
visited why dr manmohan singh and not sonia gandhi became the pm in    ,no
searched for why sonia gandhi has not become prime minister,no
searched for lic share price,no
searched for reliance share price,no
searched for wns global services share price,no
searched for wns global services,no
searched for hinduja global solutions share price,no
searched for hinduja global solutions,no
searched for firstsource solutions share price,no
visited learn python   free interactive python tutorial,yes
searched for python practice websites,yes
visited practice python,yes
searched for python practice,yes
searched for jubilant life sciences share price,no
searched for dishman carbogen share price,no
searched for federal bank share price,no
visited project euler,yes
searched for project euler,yes
searched for why auc curve is good metric,yes
searched for ff create table,yes
visited augmentations  albumentations augmentations    albumentations    ,yes
searched for albu elastictransform,yes
visited run length encoding explained   youtube,yes
searched for rle encode meaning,yes
visited rle decode produces flipped mask image   fastai users   deep    ,yes
searched for rle decode,yes
visited convert bgr and rgb with python  opencv  cvtcolor    note nkmk    ,yes
visited python examples of cv  color bgr rgb   program creek,yes
searched for cv  color bgr rgb,yes
visited accessing the dataset for use on google cloud   kaggle,yes
searched for kaggle datasets in google cloud,yes
searched for use of kaggle datasets in google cloud,yes
searched for shallow clouds,no
searched for google finance,no
searched for squash courts in hoofddorp,no
visited fitness bij healthcity   sportscholen door heel nederland,no
viewed health city hoofddorp toolenburg,no
visited home   meersquash   activity,no
viewed  more squash   activity,no
searched for squash courts in hoofddorp,no
searched for squash courts near me,no
searched for squash courts near me,no
visited http   www skwa nl ,no
searched for sports centrum near me,no
viewed sportcomplex koning willem alexander,no
searched for what is r  score in machine learning,yes
visited r  score  r squared  coefficient of determination  regression    ,yes
visited significant mismatch between  r  score  of  scikit learn  and the r    ,yes
searched for r  score example,yes
visited sklearn metrics r  score   scikit learn        documentation,yes
searched for r  score,yes
visited figure factory tables   python   plotly,yes
searched for ff create table,yes
visited logistic regression model tuning with scikit learn   part     by    ,yes
searched for hyper parameters for logistic regression,yes
searched for corona vaccine news,no
visited inference vs prediction   datascienceblog net  r for data science,yes
searched for model inference,yes
searched for boosting helps in reduces bias and variance,yes
searched for data access workflow azure,yes
searched for snapchat share price,no
searched for twitter share price,no
searched for microsoft share price,no
searched for apple share price,no
searched for google finance,no
searched for astrazeneca share price,no
visited lebara one credit   prepaid   lebara nl,no
searched for lebara one recharge,no
visited visser   van baars  het bi   big data vacature netwerk van    ,yes
viewed visser   van baars b v ,no
searched for visser   van baars,no
searched for us dollar to inr,no
searched for reliance stock price,no
visited ajanta pharma ltd    moneycontrol,no
searched for ajanta pharma stock price,no
searched for irctc stock price,no
searched for tiles for indian house wall pictures,no
visited itz antaripa    days of tableau  here  i will be uploading       github,yes
searched for    days of tableau,yes
searched for type conversion from string to date in tableau,yes
searched for trend line in tableau,yes
visited create hierarchies   tableau,yes
searched for how to know hierarchy tableau,yes
visited if  iif    case   tableau logic functions   by ian hagerman   data    ,yes
searched for if vs iif tableau,yes
visited group your data   tableau,yes
searched for groups in tableau,yes
visited blend your data   tableau,yes
searched for combining data from multiple data sources tableau,yes
visited union your data   tableau,yes
searched for table union in tableau,yes
searched for eastern standard timezone,yes
searched for extract in tableau,yes
searched for text tables in tableau,yes
searched for combined axis chart tableau,yes
visited quick start  combination charts   tableau,yes
searched for combination chart tableau,yes
searched for combinations chart,yes
visited creating a shared axis chart   tableau    business intelligence    ,yes
searched for shared axis chart,yes
visited data types in statistics  data types are an important concept of    ,yes
searched for which data types cannot be continuous,yes
searched for scholar meaning,yes
searched for scholar,no
visited beat   take a ride and rediscover your city,no
defined beat,no
visited business intelligence and analytics software,yes
searched for tableau,yes
visited how to select a machine learning algorithm   azure machine    ,yes
searched for selection of algorithms in azure ml i,yes
visited property in india   india s largest real estate platform,no
searched for square yards,no
viewed square yards,no
visited klm royal dutch airlines   flights   vliegtickets   fl ge,no
searched for flights from amsterdam to   on aug         returning aug         ,no
searched for klm flights,no
viewed flight on emirates,no
searched for flights from blr to ams on aug        ,no
searched for flights from blr to ams on aug        ,no
viewed flight on emirates,no
viewed flight on lufthansa,no
searched for flights from blr to ams on aug        ,no
searched for flights from blr to ams on aug         returning aug         ,no
visited flights   google,no
searched for google flights,no
searched for tsna algorithm,no
visited how to scrape emails from linkedin   proxyrack,yes
visited how to extract emails from linkedin   quora,yes
visited linkedin personal emails extractor   phantombuster,yes
searched for scrape email addresses from linkedin,yes
searched for eastern standard timezone,no
searched for google finance,no
searched for nietzsche,no
searched for nse  reliance,no
searched for finance,no
searched for ril share price,no
searched for nutrilite,no
visited lebara one credit   prepaid   lebara nl,no
searched for lebara one recharge,no
searched for nse  reliance,no
searched for google finance,no
visited free tableau certification dumps   simplilearn,yes
searched for tableau desktop   fundamentals certification practice test,yes
visited tableau    desktop training   udemy,yes
visited tableau desktop i  fundamentals   data analytics,yes
searched for tableau desktop   fundamentals certification,yes
searched for schutsluis   ,no
visited tableau desktop specialist   tableau software,yes
searched for tableau desktop specialist,yes
visited use compute targets for model training   azure machine learning    ,yes
searched for compute target allocation timeout in azure ml,yes
searched for compute target allocation timeout,yes
visited ultimate guide to deal with text data   analytics vidhya,yes
visited text mining in python  steps and examples   by dhilip subramanian    ,yes
searched for python tips for text mining,yes
visited vacatures   ing,no
searched for ing vacatures,no
visited https   www abnamro com en careers ,no
searched for abn amro careers,no
searched for store and load experiments azure ml lab,yes
visited load trained model   ml studio  classic    azure   microsoft docs,yes
searched for can i store an experiment model from azure designer ml,yes
visited where to save   write experiment files   azure machine learning    ,yes
searched for can i store an experiment from azure designer ml,yes
visited a      guide to speech synthesis with deep learning   by derrick    ,yes
searched for text to speech deep learning tutorial,yes
visited sklearn metrics f  score   scikit learn        documentation,yes
searched for f  score parameters,yes
searched for google chrome version history,no
visited improving your model s accuracy   apple developer documentation,yes
visited effect of increasing the number of iterations while optimising logistic    ,yes
searched for why model improvement by number of iterations,yes
searched for snap stock price,no
searched for astrazeneca share price,no
searched for google finance,no
searched for nse  reliance,no
searched for     country code,no
visited calculate the current value of the car  quickly check of your car    ,no
searched for independer used car price calculator,no
visited choosing the right metric for evaluating machine learning models    ,yes
searched for which evaluation metric to prefer for classification models,yes
visited precision              a redesign      gb ram and coffee lake    ,no
visited dell precision      vs dell precision m       compare laptops,no
visited https   www reddit com comments bstymu,no
visited dell      vs        notebookreview,no
searched for dell      vs     ,no
visited how to find the product model of your dell computer   dell us,no
searched for how to know the current system name of dell,no
searched for bloating,no
searched for ridged nails,no
searched for fluid retention,no
visited what is the cognify test for the ibm recruitment process  can you    ,no
searched for ibm cognitive ability assessment quora,no
visited the algorithmic foundations of differential privacy   cis upenn,yes
searched for differential privacy algorithms,yes
visited werken bij kpn,no
searched for kpn careers netherlands,no
searched for precision formula in confusion matrix,yes
visited us       b    detecting emotion in voice signals in a call center    ,yes
visited heart sound signals can be used for emotion recognition   scientific    ,yes
visited  pdf  advanced voice analysis of pilots to detect fatigue and    ,yes
searched for pilot voice mood detection,yes
visited the aviation herald,no
searched for aviation herald,no
visited machine learning and cognitive ergonomics in air traffic       mdpi,yes
visited machine learning in air traffic control   mathesia,yes
searched for machine learning on atc and pilot conversation,yes
visited karnataka revises quarantine sops  curfew timings  here are the    ,no
searched for quarantine guidelines in karnataka,no
searched for quarantine guidelines in kerala,no
visited the ultimate guide to using slack for team communication   huffpost,no
searched for can i create hash tags in slack,no
searched for pilot mood detection for emergencies,yes
searched for reliance share price,no
searched for nse  reliance,no
searched for google finance,no
visited namaste hoofddorp   offici le website,no
viewed namaste restaurant,no
visited pandas tricks and tips   pandas tips for analysts   analytics vidhya,yes
visited python tutorial   learn python for data science   analytics vidhya,yes
searched for tackoftheday python analytics vidhya,yes
visited vacatures   ing,no
searched for ing vacatures,no
visited home   interim valley,no
viewed interim valley,no
visited http   www dirkbarten nl vestigingen hoofddorp,no
viewed autobedrijf dirk barten hoofddorp b v  hyundai dealer,no
searched for buy used cars in netherlands,no
visited s h i p s i d e   shipping factory new tax free cars all over the world    ,no
viewed shipside tax free cars,no
visited buying a car as an expat in the netherlands   auto nl,no
visited auto export netherlands  buy new and used cars  trucks    ,no
visited used cars netherlands   ooyyo,no
searched for buy imported cars netherlands,no
searched for buy imported cars,no
searched for buy imported cars to netherlands,no
searched for imported cars to netherlands,no
searched for mazda   offer netherlands,no
searched for mazda   offer,no
searched for      off mazda   offer,no
searched for ast in python example,yes
searched for google finance,no
visited toyota rav    ontdek alles over de rav    toyota nl,no
searched for toyota rav ,no
visited car loan calculator   dutch point credit union,no
searched for car loan calculator netherlands,no
visited   marktplaats   de plek om nieuwe en tweedehands spullen te    ,no
searched for marktplaats,no
searched for shakuntala devi movie,no
viewed bynco com,no
visited https   panchang astrosage com calendars indiancalendar date      language en view amp,no
visited https   scikit learn org stable modules generated sklearn preprocessing onehotencoder html,yes
searched for onehotencoder python,yes
viewed independer   vergelijk verzekeringen,no
viewed bynco com,no
viewed  more squash   activity,no
searched for squash courts near me,no
visited http   www autobedrijfkeesbakker nl ,no
visited http   www van poelgeest nl ,no
visited http   www vandrielautomotive com ,no
searched for bmw used car dealers near me,no
viewed van poelgeest,no
viewed van driel automotive,no
viewed auto service haarlem,no
viewed autobedrijf kees bakker,no
viewed van poelgeest bmw amstelveen,no
visited http   www dirkbarten nl vestigingen hoofddorp,no
searched for used car dealers near me,no
viewed autobedrijf dirk barten hoofddorp b v  hyundai dealer,no
visited    python tips and tricks for writing better code   by pavel tech    ,yes
visited    essential python tips and tricks for programmers    ,yes
searched for python tips and tricks advanced,yes
visited python hacks   python tips and tricks   analytics vidhya,yes
searched for python tips and tricks,yes
visited how to read a csv file from a url with python    stack overflow,yes
visited https   kite com python answers how to download a csv file from a url in python,yes
searched for python code to pull data from url csv,yes
searched for python code to pull data from url,yes
visited web scraping with python   a beginner s guide   edureka,yes
searched for python code to pull data from website,yes
searched for automate managing hyperparameters in machine learning algorithms,yes
searched for managing hyperparameters in machine learning algorithms,yes
searched for automl,yes
searched for auto,yes
searched for constellation app,no
searched for constellation software,no
searched for constellation names,no
searched for leo  constellation ,no
searched for ursa minor,no
searched for scorpius,no
visited https   panchang astrosage com calendars indiancalendar date      language en view amp,no
searched for indian festivals     ,no
searched for nike running shoes,no
searched for dames en heren in english meaning,no
searched for heran in english meaning,no
searched for herein meaning,no
visited driving licence in the netherlands   tests  renewal   exchange,no
searched for process of applying driving licence netherlands,no
visited gemeente haarlemmermeer,no
searched for hoofddorp gemeente,no
visited ov chipkaart   home,no
searched for ov chipkaart,no
visited pandas profiling to boost exploratory data analysis   by sandeep    ,yes
